"product_id","page","page_order","recommended","date","text","hours","compensation","user_id","username","products","found_funny","early_access"
"1006510","1","0","True","25 February","Chinese people didn't like it 'cuz this game practices the freedom of speech that mildly taunted the leader of China, Xi.\nBy the way in Taiwan we have full liberty in regards of politics and any other occasion of basic human right which the Chinese don't, they even ban ""steam game"" on their search engine. Which again beats American enterprise by government manipulated monopoly.","6.3","","76561198182038507","Schmitt","106","","False"
"1006510","1","1","False","25 February","I don't recommend this game. I don't care about political, but they should not hide those insult in the game. If they wanna insult any one, just say it. Try to earn money from the people you are trying to insult, this is truly disgusting.","0.9","","76561198343294717","cherryliji","1","2","False"
"1006510","1","2","True","25 February","Deep describing of native Taiwan culture of 1980's. The atomsphere in the game is fulled of myth , horror and sorrow.\nBroken family relationship resulted from Superstition is incredibly depicted.\nThis game is criticized by China gamer just due to make fun of Xi-JingPing. Regardless of this, this game is  awesome!!!","1.1","","76561198927684578","acmonkey233","1","","False"
"1006510","1","3","True","25 February","Well at the risk of this review getting buried during the review-bomb/controversy. I still have to say it... this game, ""Devotion,"" is ACTUALLY amazing.\nIf I can give a surface level description of this game, think of ""Layers of Fear"" and the pros and cons of that game; but with a more compelling and tragic story.  In the very least it has an actual ending. And the build up to that ending was... *sniffles*... lets just say after playing the game I had to get up from my computer to walk around, contemplating life and it's frailties.\nI enjoyed ""Layers of Fear"" so I can look past some of the cons in that one, like it being a 'walking sim.' However the only downside, for me personally, is that in the game you walk pretty slowly (there isn't a quicker pace/jog button).\nIt is also important to note that this game is 2 to 3 hours long, which is fine. The game was as long as it needed to be to tell its story.\nIf you have time to burn or it's near Halloween, I fully recommend  this walk into the depths of despair that is ""Devotion.""","2.9","","76561197971983340","Khorneflakes!","247","","False"
"1006510","1","4","True","25 February","It's not a political satire nor a boring propaganda. RedCandleGames merely want to tell us a story about a broken family.\nIn the end, you may find out the truth.\n---[Graphics]---\n☑ Beautiful old-fashioned apartment in Taiwan (travel recommend)\n☐ Good\n☐ Decent\n☐ Bad\n☐ Can't see anything\n---[Gameplay]---\n☐ Dynasty Warriors\n☑ Can't beat the phantom\n☐ Good\n☐ Normal\n☐ Bad\n---[Audio]---\n☐ Eargasm\n☑ Very good (OST recommend)\n☐ Good\n☐ Not too bad\n☐ Bad\n☐ Earrape\n---[Audience]---\n☐ Kids\n☐ Teens\n☑ Adults\n☐ Happy Tree Friends\n☐ Everyone\n---[Difficulity]---\n☐ Just press A\n☐ Easy\n☑ Escape Room (Not too hard)\n☐ Normal\n☐ Difficult\n☐ Dark Souls\n---[Game Time]---\n☐ Long enough for a cup of tea\n☑ Short (A horror film)\n☐ Average\n☐ Long\n☐ To infinity and beyond\n---[Price]---\n☐ Priceless\n☑ Worth the price\n☐ If u have some spare money left\n☐ Not recommended\n☐ You can just burn your money\n---[Bugs]---\n☐ Never heard of\n☑ Don't get one\n☐ Can get annoying\n☐ Assassin's Creed: Unity\n☐ Get a bug spray or a flamethrower\n---[Censorship]---\n☐ Never heard of\n☑ The almighty-heavenly country you-know-what banned this game\n☐ Europe\n☐ America\n☐ Africa\n☐ Asia\n☐ Antarctica\nOMG, This game suddenly no longer available in the store, too scary to sleep!","3.4","","","asadelight","846","","False"
"1006510","1","5","True","25 February","Great game from Taiwan!\nIt realistically shows old apartment and some tradition culture in Taiwan.\nMy friend even began to scare his apartment door after watching me playing this game.","4.5","","76561198375563504","s06706s06706","11","1","False"
"1006510","1","6","True","25 February","I've played Detention before and i was told to try this one out, have to say, it isn't scary, but its a beautiful story and it made me tear up by the end,  amazing art style and music.\nDefinitely will keep an eye on future releases from you guys.","4.4","","76561198348526871","Rhodger","175","","False"
"1006510","1","7","True","25 February","Nice game","2.2","","76561198282565277","donychopper","3","","False"
"1006510","1","8","True","25 February","definitely the scariest♥♥♥♥♥♥i've ever played","2.8","","76561198076920572","Mathe","120","","False"
"1006510","1","9","True","25 February","not as horror as i expected, but still a good game.\nIf the game can last longer, it would worth much more.","3.3","","76561198296657867","hflee1031","2","","False"
"1006510","2","0","True","2019-02-25","This story is purely fictional. Any resemblance to actual individuals or events are coincidental.\n本故事纯属虚构，如有雷同，纯属虚构","3.9","","","NOTmhong","7","1","False"
"1006510","2","1","True","2019-02-25","I don't care about review bombing.","0.5","","","艹","463","","False"
"1006510","2","2","True","2019-02-25","It is very interesting. the scenes and music are touched and thrilled.","2.6","","76561198908679297","david255084","3","","False"
"1006510","2","3","True","2019-02-25","(***Containing Spoilers***)\nSo, this is going to be a rather long and tedious explanation on the political crapstorm for you folks who don't know Chinese. I'll try to be as neutral as possible.\nPlayers found a seal of the in-game cult which has 'winnie the pooh' and 'Xi Jingping' on it. Later some PRC ‘patriot’ alerted the public and government body on social media. Most Taiwanese think the mainlander were triggered because they are brainwashed to support their leader, however this is not quite the case. While some so called 'patriots' indeed got triggered by that, the majority are not too bothered by that. Most mainlanders are triggered because after this discovery, a lot of the seemingly non-political things in this game start to make sense in a political way.  They start to see proofs that this game hides suggestive insults to the general public in the mainland.\nThis game is about a cult, the cult leader's name has the exact same pronunciation as  'Mainland citizen'. If you know Chinese you know there are four or more tones for the same syllable, even the tones are the same in this case. Then the cult itself is named 'lu xin she', 'da lu' ('the mainland') is the general term for the mainland. 'xin' is 'heart' or 'mind' in Chinese. 'she' is a society. So basically people interpret this cult is as a metaphor of those who supports the mainland. The victim in this game is named 'Mei Xin'. 'Mei' generally means beauty, but it is also the name of America ('Mei Guo', emit the 'guo' for country.) So people interpreted this as 'the heart for America'. So this all starts to make sense to the mainland audience as a narrative of 'Mainland citizens' and the 'people who supports mainland' prosecute the 'desire/heart/support for America'. Which the mainland audience felt is clearly a separatism agenda. The cult sacrificial day is set on October 1st to 7th (This October is not the lunar October, lunar October 1st would make sense in this case because traditionally lunar October 1st is a day to make offering to the dead), just happens to be the PRC National Foundation day and its public holiday.  The cult candles also adds up to 49, 1949 October 1st is the foundation day of PRC. Now I personally don't know if the team really was targeting the mainland audience or not. I personally doubt it is, because this is wayyy too obvious. This would be like a 12 years old thinks god emperor Trump meme is top notch political commentary. On the other hand red candle had shown particular attention to the use of date and details before, you can read more about the various dates in detention. Very few Taiwanese seems to mention this, the ones who mentioned it dismissed it as baseless speculations, but that's probably the major reason that many former mainland fans lost faith in the developer as they see it as a direct insult to the common people, not just the government. Many mainland gamers also worry that such a politically sensitive game could trigger a knee jerk reaction from the Chinese government to completely ban steam all together.\nThis whole situation sparked a full-on online war between mainlanders and Taiwanese. The investors and publisher have all backed off and cut ties, the studio is under quite a crisis now. Their mainland social media account is deleted, the game is pull off from Chinese steam. PRC gamers started a massive review bombing campaign on the game. Some made fake screenshot and other materials to 'prove' the studio's supposed sinister intent. While some bought the game only to leave a negative review before they ask for refund. The rating dropped from overwhelmingly positive to mixed in a matter of hours. Many influencer and streamer who previously gave condolences to the game now has either cut ties or actively express their discontent. The studio has come out with various apologise and declaration statements to no avail, only to fuel the conflict even further. According to the team, the cult seal is a mistake left accidentally in by one of the graphic designers, who used popular online slangs as testing material. The mainland gamers don't believe this at all and insist the studio itself is responsible for their hidden political agenda. They also believe the studio only apologised because they are still interested in the mainland market, which only angered the gamers more. On the Taiwanese side it triggered a wave of negative attitude towards mainland gamers. There are already quite a lot of anti-mainland and dependence sentiments, especially after Xi mentioned that the PRC government will still consider military unification an option in this lunar new year's open letter to public. The reactions from mainland gamers only dragged their already negative view of mainland public into an abysmal level.  They can't understand the overreaction and they think to keep pushing and prosecute the studio after the apology is very unreasonable. Many despise what they regard as overly politically sensitive, and self-censoring mainlanders. From their perspective, it's very hypocritical of the mainlanders to promote the game as a 'homemade game' at the start then quickly turn 180 and condemn it once this ♥♥♥♥♥torm blows out. There are also cracked pirate version of the game already circulating in mainland websites despite the price is half of its international price in PRC.\nOK that's pretty much it. I hope this long and boring explanation shed a bit light for you confused bystanders. I personally think the game is decent. I don't see any suggestive theme outside of the supposed metaphoric names.  This is NOT a review for the game however, this is my mere attempt to help people to understand the situation. Some details may be completely wrong, but this is my understanding of the situation. Have a nice day and pet a puppy today :)","2.3","","76561198129158516","Vic","149","","False"
"1006510","2","4","True","2019-02-25","great game","2.6","","","functionzang","381","","False"
"1006510","2","5","True","2019-02-25","Pretty good","1.9","","76561198163159896","Leon S Kennedy","60","","False"
"1006510","2","6","True","2019-02-25","Good game!","2.8","","76561197995628890","Albert","168","","False"
"1006510","2","7","True","2019-02-25","Excellent game, review bombing is ♥♥♥♥♥♥♥t.","3.7","","","bisontrooper78","197","","False"
"1006510","2","8","True","2019-02-25","I love the storyline and the song of this game.\nIt should not be given so much down vote just because of this childish political thing","10.9","","76561198010439957","CrystalCube","56","","False"
"1006510","2","9","True","2019-02-25","I'm just gonna ignore the fact that Chinese players are salty for a silly Easter Egg because this is a damn good game. Haven't finished it but its storytelling, attention to detail and carefully crafted scare factors are absolutely amazing.\nDon't expect the likes of Outlast or PT, the game doesn't force you to run or hide from enemies but instead you are given a pleasantly terrifying stroll in an apartment building.\n9.5/10\nEdit: I'm still waiting for trading cards Red Candle. Please make it happen:D","5.1","","76561198156510295","NOT A SQUARE","136","","False"
"1006510","3","0","True","2019-02-25","An amazing game! The graphics are outstanding, and the music and atmosphere are very well managed. The plot was nice. Although the first person view does bring motion sickness to a whole new level. Compounded with the self-mutilating scene, it could be quite uncomfortable. All in all a great buy.\nP.S. Bought the game on February 21st because I played ""Detention"" before and like the game. So all the butthurt Chinese reaction that occurred after Feb 23rd was all added bonuses. I'd say it's even more entertaining than the game itself to watch that many people go nuts. This literally lengthened the playtime of the game waaaaay beyond 4 hrs!","6.3","","","Kiwimaster","5","","False"
"1006510","3","1","True","2019-02-25","highly recommend","5.2","","76561198154769605","chaowei25","9","","False"
"1006510","3","2","True","2019-02-25","For everyone who have no idea wtf these negative rating going on: if you are interested in a horrible game with excellent atmosphere of traditional Chinese culture, you should buy it. Not expensive, short story, wonderful feeling.\nMost of the negative comments wrote by simplified Chinese are given by a group of Chinese player who cannot accept the developer from Taiwan, a country with fresh air and freedom.","5.3","","","AKIHABARA!","43","","False"
"1006510","3","3","True","2019-02-25","Frankly absolutely zero interest in this game at first but then after reading the comment section, I purchased it to support the Taiwanese developer and the Taiwan.\nTo the developer, keep on the good work and looking forward to support you again in the future.","0.2","","76561198005889439","LKmm","142","","False"
"1006510","3","4","True","2019-02-25","Well, this is certainly an excellent horror game with uniquely Chinese / Taiwanese characteristics.\nIn lieu of Mainland Chinese going crazy over effectively nothing (except some political meme in a texture somewhere in a corner that 99.999% of players wouldn't notice anyway) I particularly want to recommend this game and support the Taiwanese game developers.\nNow that the Mainland Chinese market has spoken, I guess they just don't deserve to get games like this. I for one am looking forward for Red Candle to take their significant creative talents, and focus on the English speaking market instead for their next endeavor.","0.2","","76561198116905438","helios","10","","False"
"1006510","3","5","True","2019-02-25","This psychohorror little game is a great work with very high historical specificity and amazing details. It harkens back to my childhood memory but puts a sick twist to it. A complete and immersive experience. Total changed the way I see things now, for better or worse.","2.8","","76561198102347655","michael198820","18","","False"
"1006510","3","6","True","2019-02-25","Another worthy successor to the P.T. horror genre, this game may be short, but it really does pack a lot of emotional weight behind it's atmosphere and sense of style.\nIgnoring the blatant Chinese trolls triggered by the fact that not many folks like Xi Jingping, the game takes place in 80's Taiwan, which can be best described in game (and this is a major part of the story so I won't spoil anything) as where modernity and tradition are in constant conflict. Devotion has you play as a man looking for his daughter, while trying to piece together your own past on the events leading up to her daughter's disappearance. I won't give anything away, but this is a story where the main protagonist is basically a tragic figure.\nGraphic wise, the game runs really smoothly, even on a old graphics card like mine (AMD Radeon R7 200 series) so there is no need to worry about it bonking your system.","2.7","","","Ace K","758","","False"
"1006510","3","7","True","2019-02-25","Great Game. Highly recommend this game to everyone.","3.3","","76561198922412130","zzfang2","2","","False"
"1006510","3","8","True","2019-02-25","Great commentary on the importance of mental health care and the damage that social stigma could cause.","0.2","","76561198927576998","leowaterloo","1","","False"
"1006510","3","9","True","2019-02-25","T_T","5.5","","","buckydonegun","21","","False"
"1006510","4","0","True","2019-02-25","Another fantastic game made by RedCandleGames. I really enjoyed it, it may be short for some people, but the game is really polished with great, very consistent art style that reflects Taiwan's 80s, great music and story.","2.5","","76561198007246268","Magic Turtle","219","","False"
"1006510","4","1","True","2019-02-25","The devs did good job in presenting Taiwan folk superstition in depth. The game is pretty enjoyable while the plot actually reflects the true society problems in Taiwan nowadays, in both sarcastic and educational ways.","1.0","","76561198086202238","Pooky","13","","False"
"1006510","4","2","True","2019-02-25","Devotion is a very amazing Taiwaness Game. It shows lots of convection and culture of the age. The most scary part is how sad the story is.","5.1","","76561198255923154","feiteniepal","4","","False"
"1006510","4","3","True","2019-02-25","Dear all:\nI strongly recommend this game. The quality of this game is amazing! I watched several streamers playing it and even dare not to go to the toilet at night ><! However, although this game is scary, it has a heart-warming core. It will provide you a penetrative perspective on the Asian parental issues, and will show you the distinct culture of Taiwan in the 1970s.\nDon't mind those raging comments -  they are mad about a minimal political sarcasm in the game Easter egg. Just a mild sarcasm (comparing to Rick & Morty). Those overreacting zealots are victims of an authoritarian regime.\nPlease don't miss out this game. For your fun and for the freedom of speech.\n------------------------------------------------------------------------------------------------------\n本来没有想买，因为超级怕，放在library里都害怕的那种。但是因为这次风波，一定要支持一下你们。\n------------------------------------------------------------------------------------------------------\n“如果批评不自由，则赞美无意义”。2013年之前，吐槽或者玩政治梗只是相视一笑，如果实在很讨厌也会生气，但不至于到现在这种狂欢式的网络暴力的程度。\n维尼不代表大陆，至少他不能代表我。而我很喜欢这个彩蛋，结合被爆出来之后的各种反应，我觉得把他画在符上一点也没错，甚至是一种可以称为行为艺术的精妙的讽刺。\n我很爱大陆，很爱中国。歌哭于斯、聚国族于斯。我希望中国能变得更自信和开放。可现在处处噤声。\n如果中国的同胞们看到我这条评论，希望你们能去关注王林清，去关注赵宇。希望你们知道佳士、耒阳、寿光、厦门，记得三原色和疫苗。比起一个贴图，有太多的东西值得我们去在乎了。那才是和我们生活息息相关的。\n我心目中中国的未来，是政治家为人民服务，而不是人民的神。政治讽刺是达到这样的未来的必备的东西。\n也希望赤烛加油，希望你们永远不会带上脚镣跳舞，希望你们的创作能够乘着风的双翼，飞遍整个世界。\np.s 买完发现必须要游戏5分钟！为了能留言我打开了游戏挂着QAQ 内心充满了恐惧。制作组你们知道我有多爱你们了吗QAQ","0.2","","76561198141664500","akira1991","53","","False"
"1006510","4","4","True","2019-02-24","Even better than Detention. Great job on the Art and design. Not just jumpscares. AWESOME GAME! Winnie the Pooh the best meme! MUST PLAY HORROR GAME 2019","4.0","","","JediLato","44","","False"
"1006510","4","5","True","2019-02-24","awesome!","5.2","","","▒▒▒▒▒","26","","False"
"1006510","4","6","True","2019-02-24","Not a horor game fan.\nThough the interactive part of the game is too simple, but I really enjoy the art and sound atmosphere created in the game, the overall experience is magnificent !\n雖雖然遊戲本身設計過於簡單，但是美術與配樂非常寫實跟細緻！！","3.1","","","AprilCoffee","6","","False"
"1006510","4","7","True","2019-02-24","Well made game. Very scary.","13.7","","76561198035149037","smallhan","42","","False"
"1006510","4","8","True","2019-02-24","I would say Detection has a better story, but this one based on family and religions is still worth buying and playing. Both Detection and Devotion strongly relate to Taiwanese local cultures, which brings the players into one of the most mystery world of Asia.\nWould recommend anyone who'd like to learn about Asian culture.","6.7","","76561198114110727","wrpeng","39","","False"
"1006510","4","9","True","2019-02-24","Wow, never has a horror game made me cry before. Well done Red Candle!","6.3","","76561198108031310","Captain Cuddles","725","","False"
"1006510","5","0","True","2019-02-24","This is an amazing game, the story is great and the ending is epic! The FEEL is real when the theme song by No Party For Cao Dong came on in the end, and when the song Lady of the Pier came on during the end credits.\nEvery little detail took me back to my childhood in Taiwan, the red metal doors, the incense sticks by the doors, colourful bathtub, TV show, typhoon, bird chirping door bell, folklore and superstitions, Taoist talismans in the water... the list goes on.\nWinnie the Pooh banned in China is still funny to me, the game had an Overwhelmingly Positive review, before it got review bombed by Chinese people that can't take a joke.","4.2","","","Chavid","203","","False"
"1006510","5","1","True","2019-02-24","Awesome game with awesome quality.\nKeep up the good work! And don't let the haters bother you.","3.4","","76561198182951529","charlotte410061","1","","False"
"1006510","5","2","False","2019-02-24","damn im hurt by this game and surprise by its dev.'s ignorance","1.8","","76561198153553713","NONO311","57","15","False"
"1006510","5","3","True","2019-02-24","recommend to anyone want to know Taiwan more.\nthis game show you how 1980s taiwan look like, and the misterious culture of taiwan religeons.\nthat's really cool, I had lots of fun playing this game.\nAnd it also truly a good party game, you can gether friends and play it together, disguss the story together, and have a bunch of good time.","10.9","","","shiou813","49","","False"
"1006510","5","4","False","2019-02-24","Good game, but it's wrong to involve political factors.","1.1","","76561198308321127","瘟疫-lone walker","24","12","False"
"1006510","5","5","True","2019-02-24","Good game, typical Eastern Horror.\nEastern Horror includes horror and human nature,\ncomprised with the people's stories.\nSome flavors are added to a horror game if it is built up by some tragedies and some regrets,\nimpressing me and unforgettable.\nBesides, very good atmosphere.\n好遊戲 優秀的東方恐怖\n所謂東方恐怖 在恐怖之餘 仍不忘人心與人性\n一齣悲劇和一點遺憾 為恐怖遊戲增添了幾分味\n而且也不必驚悚 恐怖氛圍即已足夠","10.6","","","ec75413","107","","False"
"1006510","5","6","True","2019-02-24","I really liked this game. The horror in it was really good. It has many jump scares but the atmosphere is what makes it as scary as it is. The story turned out to be very good and it made me sad, as I was expecting it to be. Would definitely recommend it to anyone that would like to give it a try.","3.1","","","Luhuli","104","","False"
"1006510","5","7","True","2019-02-24","Nice artwork!","3.0","","","Hingge Lua","13","","False"
"1006510","5","8","True","2019-02-24","Worth every penny.","7.9","","76561198263951753","林博仁","25","","False"
"1006510","5","9","True","2019-02-24","As a Taiwanese grew up at the 80s, Devotion's production design is full of detail and well reproduced the environment of 80s. The story itself is a sad story, but Red Candle team handled the ending in an artistic way. Highly recommend!","3.7","","76561198360903743","kolala0328","3","","False"
"1006510","6","0","True","2019-02-24","this game is very nice","8.8","","76561198361616813","garypengaa","2","","False"
"1006510","6","1","True","2019-02-24","Good art and music performance, but game-time was short.","0.3","","76561198120300253","b001089006","4","","False"
