"product_id","page","page_order","recommended","date","text","hours","compensation","user_id","username","products","found_funny","early_access"
"1006510","17","9","False","2019-02-23","So disappointed by the producer for including political humiliation towards China intentionally. The game itself is good, but considering the political objective, the whole plot seems aggressive and disturbing. Not expecting all the games to be made to achieve love&peace, but still deeply disappointed by Devotion's producer's behavior and not-actually-apologizing apologize. I feel very sorry for all the Chinese players, game-video makers, painters and writers who has devoted time, work and emotion in this game, created works appraising this game, and recommending this game, and then be astonished and feel so disappointed and delete all the works after finding out the fact that the producer created the game with viciousness of our country. This week, all the people around me are buying and playing Devotion. There are no content except discussion about Devotion on all the social medias. Everyone is happy calling Devotion ""the light of Chinese-produced games"". Then suddenly we find out it's not that at all... Are you kidding me?? So, speaking of Tricking&Humiliating Players, Devotion should get a prize of it.","4.5","","","豹鱼豹鱼豹","20","14","False"
"1006510","18","0","True","2019-02-23","what is considered for the lolz becomes a hateful crime in their hollow eyes.\n10/10 would praise winnie the pooh again","0.1","","","RedMiko","129","","False"
"1006510","18","1","False","2019-02-23","烛龙一更新，所有steam的中文用户都看着他笑，有的叫道：“烛龙，你的游戏被封杀了！”他不回答，对柜里说，“招两个临时工，加一个封ip的工具”便排出九文大钱。他们又故意的高声嚷道，“你的游戏又被差评了！”烛龙睁大眼睛说，“你怎么这样凭空污人清白……”“什么清白？我前天亲眼见你的游戏被差评了好几天，被网友们吊着打。”烛龙便涨红了脸，额上的青筋条条绽出，争辩道，“褒贬不一不能算差……mixed！……独立游戏开发者的事，能算差评么？”接连便是难懂的话，什么“中式恐怖”，什么“国产之光”之类，引得众人都哄笑起来：steam内外充满了快活的空气。","0.9","","76561198055874206","Ocarin0","119","15","False"
"1006510","18","2","True","2019-02-23","Awesome game. Probably the best horror game ever made.","0.8","","","Ancient Alien","479","","False"
"1006510","18","3","True","2019-02-23","An atmospheric horror experience in the form of a walking simulator. Great attention to details in the level, excellent voice acting and a story that draws you in.","3.3","","76561197989677650","小麥 mike29tw","147","","False"
"1006510","18","4","False","2019-02-23","It'a great game, but I wouldn't recommend it.","0.4","","76561198267899212","ragnarjing","140","5","False"
"1006510","18","5","True","2019-02-23","Speechlessly delicate and touching story telling about a tragedy in a troubled family.\nFrom every texture and detail, and voice it's of no doubt the team has put all of the spirit into it.\nIt's really a pity to have such good story being carried away by a joke (or sarcasm) an artist in the team made.\nThat's not a good practice, but a sincere apology should be enough to make up for it.\nIf you care about a child's misbehavior, you would remind him/her about the fault but not ruining them, isn't it?\nThe saddest story is about seeing such benevolence is nowhere to be found in reality.","3.6","","","Al.zommer","72","","False"
"1006510","18","6","True","2019-02-23","Simply put: Ignore all the negative reviews. They come from♥♥♥♥♥♥♥♥off Chinese players who found an ester egg that calls their president a ""moron"" This factor does not make this a bad game, in fact, it is an incredible game. The polish and incredible detail that was put into this game is astounding. I enjoyed every minute of it.\nTo everyone review bombing this very good game: ♥♥♥♥ off and grow up.\n长大中国！\n长大中国！\n长大中国！","3.1","","76561198268407347","ITORIFFIC","158","","False"
"1006510","18","7","True","2019-02-23","Great game with excellent story. Doesn't deserve to get review bombed over a joke","5.5","","","GoodSashimi","93","","False"
"1006510","18","8","True","2019-02-23","If u are denying the game because of one single picture is kind of offended to u, then u are probably not recommended to play this game. And in the graphic, I don't really see where is the offended part either. Which word is offended to u? Winnie the pooh? Funny to me.","4.3","","","Kaiphone","25","","False"
"1006510","18","9","True","2019-02-23","(V) Xi Jinping Winnie the Pooh Moron\n(V) Chinese people helped promote Xi is Winnie the Pooh\n(V) Proved CCP's internet filter is a fail\n(V) Does CCP has the balls to ban Disney","0.2","","","Pandia [TW]","1359","3","False"
"1006510","19","0","True","2019-02-23","This game is absolutely brilliant, and a must-play for fans of games that utilize atmospheric, surreal setpieces and strong environmental storytelling. Although much of the imagery in this game is extremely obtuse and heavily couched in Taiwanese culture and religion, it tells a very down-to-earth story that many people will be able to relate to, and one that seems especially relevant today. The graphics are beautiful, the imagery is stunning and absolutely striking, the atmosphere is like nothing I've ever seen before, and it's much more than just another horror-flavored walking sim. There are multiple points throughout the game that utilize creative changes in gameplay that add even more layers of meaning and surrealism. There are also many creative and interesting puzzles that actually add depth to the story and themes. I think any fan of story-driven, psychological horror will be able to enjoy this.","4.2","","76561198189658538","carfox6","49","","False"
"1006510","19","1","False","2019-02-23","LOL\nTaiwanese Game f**k around with mainland ==> DEAD","0.1","","76561198169007905","Billy(* - *) . PT","43","13","False"
"1006510","19","2","True","2019-02-23","I picked up this game after playing and loving Detention. I decided to stream it I reckoned it'd be a good way to get back in to it and I was not wrong! I was  completely terrified, as was the audience. Red Candle Games have a real knack for explaining heart breaking situations in a symbolic, horrific way, and it's mesmerising. How they can go from terrifying me to making me cry every game is an art form.","3.2","","","Kitiko_c","250","","False"
"1006510","19","3","False","2019-02-23","Game is okay. Devs are not. Not worthy.","0.2","","","Dan","122","10","False"
"1006510","19","4","True","2019-02-23","A good horror game with an unsettling atmosphere and great soundtrack. Would recommend to people who enjoyed Detention.\n8/10","1.1","","76561198206138233","ZenPup","255","","False"
"1006510","19","5","True","2019-02-23","Absolutely incredible game. For deep, atmospheric horror with gorgeous visuals, excellent sound design, and a macabre tale you can't do much better. This is well worth the money and, if you enjoy games like Layers of Fear, you won't be disappointed here, either.\nDetention was a hit for me, and this second title by Red Candle killed it again. I can't wait to see what they make next.","3.9","","76561197999438111","Barney Champaign","467","","False"
"1006510","19","6","True","2019-02-23","It saddens me to see so many brain-washed Chinese, albeit allegedly educated in the western world. When even the oppressed are helping the oppressor, there is no hope fighting against the downward spiral of the government. The least I can (must) do, with the little strength bestowed in me by HKD$82, is to throw a stone at the wall in despair.","0.1","","76561197974994700","DodgyStyle","85","","False"
"1006510","19","7","True","2019-02-23","I bought the game cause the dev dares to make the dog eater angry.\ndog yiping is a pig suck it lmfao.","0.3","","","Nickk","242","5","False"
"1006510","19","8","True","2019-02-23","A unique and interesting historical setting, and an ambitious but intimate and tightly-plotted story that reminded me of a Bong Jun-ho thriller.","4.4","","","bapplegate","174","","False"
"1006510","19","9","True","2019-02-23","It's an amazing game with a stunning story and fearsome but realistic atmosphere  which referencing 80's living environment of Taiwan.\nI start this game because the name of the developer and the high regard of its previous piece: Detention. I am a person who don't play horror game but the story keep driving me to overcome the fear. And I almost cried in the ending.\nThe game will need a basic understanding of Taiwan's History Culture to fully understand the story and only need up to 3 hours to finish the whole. But with $17 price, I am happy to what I got. Not even mention this is their first 3D game and they delivered a master piece.\nIt makes me feel really funny of so many people hate this game/developer because of a single easter egg. But I will say the company gave their apology and took the political consequence. With the love of the game I will hope they survive and keep coming with next good game.","3.6","","76561198008634922","wurdy86","39","","False"
"1006510","20","0","True","2019-02-23","It needs to be easier to save. I can only take so much at a time :(","0.4","","","Chroniko","288","","False"
"1006510","20","1","False","2019-02-23","Games are a form of escapism. Maybe, after a long hard day of work, you want to vent your anger. You can go and play a shooter or a slasher. It is relaxing. Maybe, you just want to chill and forget your troubles with some simulator or walk in a beautiful surreal scenery as a form of meditation. Maybe you want to feel something that you could never feel in real life in a safety of your appartment with racing games. Want to feel like a hero? RPG. Want to feel like smart general? Strategy. Want to stop feeling lonely? Dating sims. Want intellectual exercise? Puzzles. Want some adrenaline? Horror games.\nGames are supposed to be fun. Not ""funny"", they don't have to be lighthearted. But fun. Something that will make you immerse yourself in world, different from your own and feel satisfied when you're done. And not feel like you're being forced into the real world against your will once more.\nI know two languages - English and Russian. I can't read the political message the ingame posters carry. And so, I just played this game, not knowing about the ♥♥♥♥♥torm surrounding it. And I liked this game.\nDetention was, hands down, my favorite horror from 2017, so I expected more of the same from Devotion. Some horror, but not as a main focus. Good, interesting, intriguing story, with a lot of symbolism. And in that regard, Devotion was a bit of a letdown. I still enjoyed it, but it was not as good as Detention.\nThe symbolism was a very prominent part of Detention. I still think that the way they presented\nin that game was top-tier brilliance, one of the best moves in games that I've seen. Right from the start, Devotion presents you with\nThat was a completely pointless misdirection. And all the other symbolism in the game was way too on the nose and easy to read. It was just... uninspired. I knew where the story was going after less than an hour of gameplay, and until the end, there were zero surprises.\nNot to mention that the ending itself was awful. Abrupt, it didn't draw that final line I was hoping to see, instead just showing you some surreal visage and credits. It was awfully unsatisfying.\nOther than that though, the game was alright. I liked the story, predictable as it was. The voice acting was great. The music was fantastic. The horror elements... kinda disappeard after the 1/3 of the game, with the rest of it being hardly scary at all. It's just an average game, that I enjoyed playing and will forget much faster than I could ever forget Detention.\nHowever.\nNo matter what the message, you shouldn't use games as your political platform. As a Russian, I'm sick and tired of listening about ""those evil Russians"" in American media. And I'm equally tired of listening about how ""we are so virtuous, unlike those horrible spoiled Americans"" in Russian. I don't need to hear about Ukraine, I don't need to hear about England, about feminism, transgenders, homophobia, racism from either side - they are both equally annoying - I don't need this in my ""free from this political ♥♥♥♥♥♥♥t"" time. Time I use to escape and have fun. Time, I play videogames.\nAnd while I personally have no attachment to the conflict this particular drama is about, I don't think that Devotion devs had the right to take that time of peace away from their players. It is dirty. It is despicable. It is... just a shame that what could just be a cute little story, a fun horror game, had to turn into... this.\nShame on you.","3.5","","","Tom Sawyer","526","28","False"
"1006510","20","2","False","2019-02-23","So u north americans won't mind if some chinese games made up ur national day some taliban's celebration day, and calling this taliban's leader ""mr. uscitizen""...? touching\n——————\nWhat a pity, living in nations which have freedom of speech is so rare and precious on this plant, yet lots of people seems not having the knowledge and intelligence to truly enjoy it... as a person who from a land which was full of “dictatorship, speech control and brainwashing”, i was so so sad for it :(","2.4","","","HT Media！","275","21","False"
"1006510","20","3","True","2019-02-23","spoopers","2.5","","","YOUR MOVES ARE WEAK","232","","False"
"1006510","20","4","True","2019-02-23","Really impressive! Nice job red candle. Nice job Taiwan.","3.5","","76561198146436532","HKChan","9","","False"
"1006510","20","5","False","2019-02-23","As a legal professionals and a citizen from Republic of China (AKA Taiwan), I absolutely respect the freedom of expression, but I also believe this is NOT some value that we should stand up for, such as satirize somebody's fitness by calling him 'Winnie-the-Pooh', and insult somebody by calling him 'Farking Moron', then pretending this is so called 'the right of speech' and not abuse.\nI love Devotion very much, I own this game and I watch people play this game on Twitch, I must commit that Red Candle Games did very well job on telling story, art, music on this product, but since the above-mentioned controversially stuffs are also part of this game(they present those stuffs in Chinese, and they are not being translated, therefore people who can not read Chinese may not realize them. also even though they remove those stuffs in update versions, they still can't gloss over the facts of what they have done), I could not recommend this game to people, because if I do, that means I agree that as long as people did something good, then they are also allowed to do something bad, this is just not feeling right to me.","13.9","","","Keiu","15","24","False"
"1006510","20","6","True","2019-02-23","Execellent narrative with perfect art crafts of Taiwan 80s ,especially the amulet.","6.2","","","DappleHelix","25","","False"
"1006510","20","7","False","2019-02-23","Updates:\nAs there are many more people start to read this, I want to put one of my explanations into my reviews to try to help those who are willing to understand the rationales behind this incident. My point is to spread the facts out and let the truth speaks for itself. I'm willing to have rational communication, but not cynical condemning. My comments are as follow:\nThank you for commenting rationally and calmly. Just to extend your understanding about this, here are some additional cultural ""memes"" that are used in the game design.\n1. The evil ritual of putting Luxin into an alcohol bath was set from Oct. 1 to Oct. 7 which happens to be the National Day of China Mainland.\n2. The literal translation of the cult's name ""Lu Xin Hui"" happens to be Mainland Heart Gathering.\n3. The name of the cult's leader happens to be ""Lu Gong Min"" which translates literally into Mainland Citizen (homophonically).\nHere are just three of the many symbolic metaphors that people discovered. Do you think by making 4th of July as the date of an evil ritual is not demonizing your people? It's very sad that most of the western media only focuses the one meme that could possibly be a catchy headline, but I think these facts should also be known by the others as well.\nIn fact, what frustrates me the most is, the game developers have chosen to hide these political metaphors into the game, while we, the players, were rooting them by purchasing and recommending the game. They must think they are smart.\n-- My original review --\nI've played this game for 4 hours, purchased OST, recommended to many of my friends. Actually, I was never a big fan of horror games. Detention was the first horror game that I bought. It's simply because I like its setting and the cultural elements that I resonated with so deeply. Obviously, Devotion has pushed the greatness of its predecessor one step further. It unraveled an astonishing story using its brilliant game design and helped share the culture that I like with the world.\nHowever, after I found out the drama about the game settings this morning, I simply feel SAD. I'm frustrated to see how some of the game designers have sneaked their political perspectives into the game in such a despicable way. It is hard to see a game that you enjoyed, loved, and cherished has chosen this way of expressing their understanding of the people on the other side. Indeed, anyone should have the right to express their perspectives, as we are all in a diverse society full of different opinions, but I don't think this is the right way. I think a game should be a place where people can drop their discrepancies (even temporarily) and truly embrace the enjoyment and touching moment together. I don't think condemning each other can help resolve any of those conflicts that we have. As some have argued in the comments that an artist can do whatever they want to do with their work, I, as a player, choose to express my sadness and disappointment this way.","4.0","","76561198078509853","Aurua","68","16","False"
"1006510","20","8","True","2019-02-23","really nice, they have recreated the 1980s Taiwan household setting really well, the scares are not over the top, a lot of interesting gameplay, all the translation is really well done too\neach chapter has a different theme which keeps it really interesting, the visual and audio work are way above average for an indie game","3.0","","","NAN メロン ᕦ(ò_ó*)ᕤ","1171","","False"
"1006510","20","9","True","2019-02-23","Love the game, albeit it's a little short, but it's atmospheric and storytelling is stunning.\nThe jump scares do feel like they're there only because it's a horror game, but the fact that it ties so closely with the 1980's Taiwan society is the main reason why it's so horrifying.\nWell translated so that non-Taiwanese friends can enjoy the story as well, and have a nice glimpse to what Taiwanese families could have faced in the 1980's, and further explore the slow progress of Taiwanese civil protection laws.","7.1","","76561198142622379","pilferkitty","78","","False"
"1006510","21","0","True","2019-02-23","High quality music and decent story. Just like watching a 3 hour movie.","3.3","","76561198361285348","Turok","10","","False"
"1006510","21","1","True","2019-02-23","SO\nthis game IS just a walking sim with a couple puzzles, but it was just what i needed and the story had me almost in tears at the end.","4.3","","","shaffsonaplane","103","","False"
"1006510","21","2","True","2019-02-23","It's a great，short game which combined traditional Taiwanese non-formal religion culture and how to treat Mental illness as getting hunted in early 1980's Taiwan,but if you saw Chinese crazy behavior about this game,you will understand this is an  ARG game whose the virtual contrasts with the reality about crazy political beliefs.\nWwwwwwww","9.7","","76561198205242601","grosshochian","78","","False"
"1006510","21","3","False","2019-02-23","It could have been a good game .\n\nAs a horror game the most important part of the game is atmosphere. Devotion did a great job by accurately rebuilds the environment which really makes you feel that you are trapped in an apartment of Taiwan in 1980s. The puzzles are also good and the best part of this game is the story line. The true story is hidden behind all the puzzles and setups during your exploration of the game.\nHOWEVER, again, as a horror game the most important part of the game is atmosphere. When politics is involved it basically ruins everything the game makers try to build. Now since I know the Fulu on the wall which was really a BIG part of the atmosphere is nothing but a bad joke, nothing is scary anymore, I cannot immerse myself in the game because of it at all, as a big horror game fan, this is just such a big deal breaker.","0.6","","","STAN","48","21","False"
"1006510","21","4","True","2019-02-23","這是最好的一款遊戲，畫面精美、不僅劇情引人入勝而且還讓人深省，整體而言jumpscare的比例不會太高，真正恐怖的是遊戲氛圍與劇情所營造出來的悲劇，是由台灣獨立開發團隊所推出的經典作品。\nIt’s one of the best horror game. Excellent graphic and atmosphere. Story is tragic but meaningful. Although there is jumpscare but it was less in the game. The true horror part is the tragedy and the nonsense from China. It’s the best work ever from Taiwan indiegame developers.","2.2","","","ckmagician","63","","False"
"1006510","21","5","True","2019-02-23","Great game. I like that the story depicts one of the social problems in all society with a twist of horror.\nThe music is also very great.","4.1","","76561198084013440","martinetlee","50","","False"
"1006510","21","6","False","2019-02-23","Supposed to be a good game without political content.","0.1","","76561198261172587","Sakura","104","11","False"
"1006510","21","7","True","2019-02-23","A tragic story-based horror short with a lot of heart. With every moment of your time.","5.6","","","Analog Pill","1714","","False"
"1006510","21","8","False","2019-02-23","A good game, but political metaphor is disgusting.","9.2","","76561198114999679","Sofic","29","10","False"
"1006510","21","9","True","2019-02-23","Fear is of the unknown.\nGreat game for a small studio, the visuals and nods to Taiwanese culture is amazing, the story is simple, gameplay is smooth.\nIgnore the buttthurt Chinese trolls that are downvoting this game.\nWhat I love about this game is how they managed ambition with practicality, the game doesn't try to outdo others like Layers of Fear, instead focusing on what they can do, they managed to create a short, simple story that isn't overly-ambitious to a point of exhaustion, which makes it on par for most of the genre-defining horror walking simulators. But it's more than that, for me it threads the line between Gone Home and Layers of Fear, while definitely a horror game, it doesn't bind itself to the genre, instead choosing to start from horror, but as you unravel the story, the monsters become human, morphing from horror to a family tragedy. Horror about what happened slowly turns into a father's search for truth.","2.5","","76561198028661153","Yu-Zora","99","","False"
"1006510","22","0","True","2019-02-23","Red Candle is so incredible awesome to make this game. Every thing is soooo great. If the highest score is 10, I'll give them 9.9!\nI dont know why Chinese gives them such low points just because there is a texture called Xi ""Winnie the Pooh"". That is so stupid! If you believe those stupid comments then you probably miss a great game though.","4.2","","76561198045257507","paiivy","3","","False"
"1006510","22","1","True","2019-02-23","Great game!!!!!!!!!!!!!","4.4","","76561198412314411","linhunk.taiwan","1","","False"
"1006510","22","2","True","2019-02-23","This is a great horror game. Red Candle has been a developer I've had my eye on since they released Detention but I am an absolute baby when it comes to horror so I never bought it; I probably would have never bought this game if it wasn't for the unjust backlash and review bombing that the mindless Chinese ""we must have good social credit"" gamers are giving it.\nMany tirades against this group are being written and will continue to be written and I could easily go on about this topic as well for what would end up being pages about how aggravating it is that an objectively well-made game is being treated unfairly by this group — but there isn't really a point in doing that. I don't even think the Chinese gamers who are currently review bombing this game really mean what they say (even if they have to claim they do); we would all probably do the same thing if our government led by a Disney character was constantly holding a gun to our head and very publicly silencing any voices of opposition.\nJust buy the game. It’s honestly phenomenal in its execution and Red Candle needs all the support they can get right now because they are currently one of the best indie teams around.","4.7","","76561198094485610","Mister Psychosis","190","","False"
"1006510","22","3","True","2019-02-23","Nice game, especially for a small studio in Taiwan. Plus, I'd like to say that most angry Chinese comments demonstrated their loyalty to the Big Brother.","1.7","","76561198389439762","Winnie the Great","23","","False"
